Question,Answer,Acupuncture Points,Chinese Pharmacopeia
How to treat baby's scalp cradle cap with herbs?,Cradle cap requires external treatment only. Herbal oils or washes can soften scales and clear Damp-Heat. Gentle removal after softening. Address internal Dampness through mother's diet if breastfeeding or through formula adjustment.,"Scalp tuina: very gentle massage to stimulate Qi and Blood flow. ST-36 (Zusanli), SP-6 (Sanyinjiao), SP-9 (Yinlingquan) to address internal Dampness root","External herbal oil: coconut or olive oil base with Ku Shen (Sophora), Bai Zhi (Angelica Dahurica). Apply, let sit, gentle brush removal. Herbal wash after with cooling, Damp-clearing herbs."
What are baby's sleep-wake cycle issues?,Day-night reversal common in newborns. Yang should descend at night for sleep; Yang ascending at night causes wakefulness. Establishing rhythm helps organ systems develop regular patterns. Sunlight exposure during day helps Qi regulation.,"Evening calming routine: Yintang gentle stroke, Anmian light pressure, HT-7 (Shenmen) minimal touch. Morning stimulation: gentle limb massage, light exposure","Avoid herbs for day-night reversal unless severe. Support through behavioral patterns: bright light during day, dim at night. Through mother: ensure her Qi is regulated."
How to use moxa for newborns safely?,"Direct moxa on infant skin is NEVER appropriate. Indirect moxa (warming nearby, not touching) can support Yang and warm Cold. Use very cautiously for Cold conditions, Yang deficiency, or diarrhea. Must maintain safe distance and test temperature carefully.","Safe moxa locations: above REN-8 (Shenque) - several inches away, warming abdomen. Near ST-36 (Zusanli) for Spleen support. Near REN-4 (Guanyuan) for Yang support - all with extreme caution","Moxa supports Yang-tonifying treatments. Can be combined with warming herbs through mother if breastfeeding. Always prioritize safety - when uncertain, avoid moxa and use warming compresses instead."
What causes baby's startle reflex (Moro) issues?,"Exaggerated startle reflex indicates Gallbladder Qi deficiency (Gallbladder controls decision and courage), Heart Blood deficiency, or Shen disturbance. Normal primitive reflex should integrate by 4-6 months. Persistent startle requires calming and strengthening treatment.","HT-7 (Shenmen), PC-6 (Neiguan), GB-40 (Qiuxu), Yintang, gentle holding and swaddling. Regular calming tuina builds sense of safety","Through mother: Gui Pi Tang (Restore Spleen) to nourish Heart Blood. Calming environment, consistent routines. Gentle Shen-stabilizing approach supports nervous system maturation."
How to address infant reflux (GERD)?,Infant reflux shows Spleen and Stomach Qi deficiency with rebellious Qi. Immature lower esophageal sphincter in Western terms; weak Stomach Qi unable to descend in TCM. Most improve by 12 months as Spleen matures. Severe reflux needs medical evaluation.,"Downward stroking on Ren channel, REN-12 (Zhongwan) gentle downward pressure, ST-36 (Zusanli) to strengthen Spleen, PC-6 (Neiguan) for nausea. Keep baby upright after feeding",Through mother: Si Jun Zi Tang with Ban Xia (Pinellia) and Chen Pi (Tangerine Peel) for descending Qi. After 6 months: extremely diluted formula if needed. Positioning and feeding technique crucial.
What are red flags requiring medical attention?,"TCM practitioners must recognize when immediate medical care needed: high fever in newborn, signs of dehydration, projectile vomiting, blood in stool, lethargy/unresponsiveness, breathing difficulty, seizures, bulging fontanelle, blue coloring. TCM supports medical treatment but doesn't replace it.","After medical stabilization, TCM can support recovery and strengthen constitution. Assessment of when TCM appropriate vs. when medical emergency is critical clinical skill","TCM and Western medicine work together for infant health. Know scope of practice. Refer appropriately. After acute crisis, TCM excellent for constitutional strengthening and preventing recurrence."
How to educate parents about TCM for newborns?,"Parents need clear information: TCM is gentle, supportive care for newborns focusing on strengthening constitution, supporting development, and treating minor ailments. Set realistic expectations. Teach basic tuina they can do daily. Explain when to seek medical vs. TCM care.","Teach parents simple tuina: gentle abdominal massage for digestion, calming strokes for fussiness, basic acupoint locations they can press gently. Empowers parents and provides bonding","Provide clear guidance on appropriate herbs (usually none for young infants). Emphasize prevention through proper care, feeding, and environment. Build trust through education and appropriate treatment boundaries."
What is the long-term TCM approach for newborns?,"First year focuses on supporting organ system maturation, building Wei Qi, establishing strong constitution, preventing illness, and addressing minor issues gently. Regular constitutional assessment and appropriate seasonal support. Foundation laid in infancy affects lifelong health.","Regular gentle treatments: monthly or with seasonal changes. DU-12 (Shenzhu), ST-36 (Zusanli), appropriate points for constitution. Preventive rather than crisis-based care","Constitutional formulas through mother if breastfeeding, or gentle external treatments. As child grows, gradually introduce appropriate internal herbs. Long-term relationship supports optimal development and health."
