Question,Answer,TCM Acupuncture Points,Pharmacopeia
How do you diagnose Yang deficiency?,Yang deficiency shows deep weak slow pulse with pale wet swollen tongue and white coating. The pulse is without Yang warmth; tongue is pale and enlarged from fluid accumulation.,"CV4 (Guanyuan), GV4 (Mingmen), ST36 (Zusanli), BL23 (Shenshu)",Jin Gui Shen Qi Wan (Golden Cabinet Kidney Qi Pill)
What pulse-tongue signs indicate Phlegm-Dampness?,"Phlegm-Dampness shows slippery pulse with swollen tongue, greasy coating, and tooth marks. Pulse is smooth and full; tongue is enlarged with turbid sticky coating obscuring body.","ST40 (Fenglong), SP9 (Yinlingquan), CV9 (Shuifen), SP6 (Sanyinjiao)",Er Chen Tang (Two-Cured Decoction)
How do you identify Blood stasis?,"Blood stasis shows choppy or wiry pulse with purple/dark tongue, purple sublingual veins, and possible stasis spots. Pulse is rough and unsmooth; tongue shows stagnant Blood color.","SP10 (Xuehai), BL17 (Geshu), LV3 (Taichong), SP6 (Sanyinjiao)",Xue Fu Zhu Yu Tang (Drive Out Stasis from the Mansion of Blood Decoction)
What indicates Liver Qi stagnation?,"Liver Qi stagnation shows wiry pulse particularly at Guan position with normal or slightly red tongue, possible side swelling, and thin coating. The wiry pulse indicates constraint and tension.","LV3 (Taichong), LV14 (Qimen), GB34 (Yanglingquan), PC6 (Neiguan)",Xiao Yao Wan (Free and Easy Wanderer)
How do you diagnose Liver Fire?,"Liver Fire shows wiry rapid pulse with red tongue especially on sides, red points on sides, yellow coating, and dry appearance. Both pulse and tongue show Heat with Liver involvement.","LV2 (Xingjian), LV3 (Taichong), GB34 (Yanglingquan), LI11 (Quchi)",Long Dan Xie Gan Tang (Gentiana Drain the Liver Decoction)
What pulse-tongue combination indicates Heart Fire?,"Heart Fire shows rapid full pulse at left Cun position with red tongue especially at tip, red points on tip, possible ulcers, and yellow coating. Tip redness is key diagnostic feature.","HT8 (Shaofu), HT7 (Shenmen), PC7 (Daling), CV14 (Juque)",Dao Chi San (Guide Out the Red Powder)
How do you identify Spleen Qi deficiency?,"Spleen Qi deficiency shows weak pulse at right Guan with pale swollen tongue, tooth marks, and thin white coating. The weakness at Guan position specifically indicates Spleen involvement.","ST36 (Zusanli), SP6 (Sanyinjiao), SP3 (Taibai), BL20 (Pishu)",Si Jun Zi Tang (Four Gentlemen Decoction)
What indicates Kidney Yin deficiency?,"Kidney Yin deficiency shows thin rapid pulse at both Chi positions with red tongue, possible peeling on root, cracks, and little coating. Deficiency Heat signs appear in lower body area.","KD3 (Taixi), KD6 (Zhaohai), SP6 (Sanyinjiao), BL23 (Shenshu)",Zuo Gui Wan (Restore the Left Kidney Pill)
How do you diagnose Kidney Yang deficiency?,Kidney Yang deficiency shows deep weak slow pulse at Chi positions with pale wet swollen tongue and white coating. The pulse is weak at Kidney positions; tongue shows Cold-Damp signs.,"GV4 (Mingmen), CV4 (Guanyuan), BL23 (Shenshu), KD3 (Taixi)",You Gui Wan (Restore the Right Kidney Pill)
What pulse-tongue signs indicate Damp-Heat?,"Damp-Heat shows slippery rapid pulse with red tongue, yellow greasy coating, and possible swelling. The combination of slippery (Damp) and rapid (Heat) with greasy coating is diagnostic.","SP9 (Yinlingquan), LI11 (Quchi), ST40 (Fenglong), ST44 (Neiting)",San Ren Tang (Three-Nut Decoction)
How do you identify Wind-Heat invasion?,"Wind-Heat shows floating rapid pulse with red tongue tip and sides, thin yellow coating, and red appearance. The floating pulse indicates Exterior; rapid with red shows Heat.","LU7 (Lieque), LI4 (Hegu), LI11 (Quchi), GV14 (Dazhui)",Yin Qiao San (Lonicera-Forsythia Powder)
What indicates Wind-Cold invasion?,"Wind-Cold shows floating tight pulse with pale or normal tongue, thin white coating, and moist appearance. Floating indicates Exterior; tight shows Cold contraction; white coating confirms Cold.","LU7 (Lieque), LI4 (Hegu), BL12 (Fengmen), GB20 (Fengchi)",Gui Zhi Tang (Cinnamon Twig Decoction)
How do you use pulse-tongue diagnosis for prognosis?,"Improving pulse (from weak to stronger) with improving tongue (coating returning, color normalizing) indicates good prognosis. Worsening signs (scattered pulse, mirror tongue) suggest poor prognosis. Consistency between pulse and tongue shows clearer patterns; inconsistency requires deeper investigation.",Pattern-specific points based on current condition,Adjust formulas based on progression and changes
