asset_type,question,answer,category,tags
bazi,"What is BaZi analysis?","BaZi (八字 Four Pillars): Birth chart using year, month, day, hour pillars. Each pillar has Heavenly Stem and Earthly Branch. Reveals constitutional tendencies, strengths, weaknesses. Day Master (Day Stem) represents self. Analysis shows element balance and Ten Gods relationships.",bazi,fourpillars|birthchart|analysis
bazi,"How does Day Master affect constitution?","Day Master constitution: Wood DM - needs Liver support, flexible nature. Fire DM - Heart focus, expressive personality. Earth DM - Spleen center, grounding needed. Metal DM - Lung care, structure oriented. Water DM - Kidney attention, adaptable, creative. Treatment supports Day Master element.",bazi,daymaster|constitution|elements
bazi,"What are favorable and unfavorable elements?","Favorable elements (用神): Elements that balance the chart. If Day Master weak, favorable elements support it. If Day Master strong, favorable elements drain it. Treatment emphasizes favorable elements through diet, lifestyle, points, herbs. Unfavorable elements to minimize exposure.",bazi,favorable|elements|balance|yongshen
bazi,"How to use BaZi for treatment planning?","BaZi in treatment: Identify weak elements - tonify corresponding organs. Note element clashes - watch for related health issues. Favorable timing - treat during supportive hours/seasons. Career/relationship stress - may manifest as health issues. Constitutional treatment based on chart.",bazi,treatment|planning|elements|timing
bazi,"What are the Ten Gods in BaZi?","Ten Gods relationships: Friend (比肩) - support, competition. Rob Wealth (劫财) - taking, siblings. Eating God (食神) - creativity, relaxation. Hurting Officer (伤官) - rebellion, talent. Wealth (财) - money, father, wife. Officer (官) - career, authority, husband. Resource (印) - mother, knowledge, protection.",bazi,tengods|relationships|shishen
