Question,Answer,Acupuncture Points,Chinese Pharmacopeia
What are the key TCM considerations for elderly patients (70-120)?,"Elderly patients have natural decline in Kidney Jing, Qi, Blood, Yin, and Yang. Treatment must be gentle: shallow needling, fewer points, shorter retention time, lower herb doses. Focus on quality of life, safety, maintaining independence, and working with Western medical care. Respect fragility and individual goals.","Use fewer points (5-8 maximum), gentle technique, avoid strong stimulation. Core elderly points: ST-36, SP-6, KI-3, LI-4, HT-7, DU-20, BL-23","Reduce all herbal doses to 1/3-1/2 normal adult dose. Favor gentle, tonifying formulas. Avoid overly draining or strong cold/hot herbs. Monitor for interactions with medications."
How to assess mobility issues in elderly patients?,"Assess walking distance, assistive devices (cane, walker), ability to rise from chairs, stair climbing, and fall history. Mobility decline reflects Liver-Kidney deficiency (tendons, bones), Spleen Qi deficiency (muscle weakness), Qi and Blood deficiency, or specific joint issues (Bi syndrome).","ST-36 (Zusanli), GB-34 (Yanglingquan), BL-23 (Shenshu), KI-3 (Taixi), SP-6 (Sanyinjiao), BL-40 (Weizhong), GB-39 (Xuanzhong)",Du Huo Ji Sheng Tang (Angelica and Loranthus) for Liver-Kidney support with Bi syndrome; Bu Zhong Yi Qi Tang if significant Qi sinking; gentle doses.
What causes falls in elderly and how to prevent?,"Falls indicate Liver-Kidney weakness (legs, balance), Qi and Blood deficiency (dizziness, weakness), Phlegm-Dampness (dizziness), medications (orthostatic hypotension), or environmental hazards. TCM supports balance, strength, and circulation while addressing safety concerns.","GB-34 (Yanglingquan), GB-39 (Xuanzhong), KI-3 (Taixi), BL-23 (Shenshu), ST-36 (Zusanli), DU-20 (Baihui), GB-20 (Fengchi)",Du Huo Ji Sheng Tang for Liver-Kidney weakness; Bu Zhong Yi Qi Tang for Qi deficiency; Ban Xia Bai Zhu Tian Ma Tang for Phlegm-Dampness causing dizziness.
How to support elderly with multiple chronic diseases?,"Multiple conditions (heart disease, COPD, diabetes, kidney disease) reflect multi-system Qi, Yang, and Jing deficiency. TCM provides supportive care improving symptoms and quality of life while coordinating with medical management. Avoid herb-drug interactions.","Gentle constitutional support: ST-36, KI-3, SP-6, HT-7, LU-9, REN-4, BL-23 - adapt based on primary symptoms and individual tolerance",Gentle tonification: modified Shi Quan Da Bu Tang (Ten Complete Great Supplementing) or Ba Zhen Tang; individual organ support based on diseases; careful medication interaction review.
How do medications affect TCM treatment in elderly?,"Polypharmacy common in elderly. Many medications deplete Qi, Yang, or Yin, cause Dampness, or dry fluids. Side effects may present as TCM patterns. Must know all medications to avoid interactions and understand side effect patterns versus disease patterns.","Support medication side effects: ST-36, SP-6 for digestive issues; HT-7 for sleep/mood meds; KI-3, BL-23 for diuretics depleting Kidney; LR-3 for statin side effects","Choose herbs carefully avoiding interactions. Common concerns: blood thinners (avoid blood-moving herbs), diabetes meds (monitor with tonics), blood pressure meds (careful with warming herbs)."
What causes cognitive decline in TCM terms?,"Cognitive decline represents Kidney Jing depletion, Heart-Kidney disconnection, Phlegm misting the orifices, Blood stasis in brain, or Spleen Qi unable to send clear Yang to head. Dementia shows profound multi-system depletion. TCM provides supportive care.","DU-20 (Baihui), Sishencong, HT-7 (Shenmen), KI-3 (Taixi), ST-36 (Zusanli), ST-40 (Fenglong), SP-6 (Sanyinjiao), PC-6 (Neiguan)",Kidney essence: Liu Wei Di Huang Wan or modified. Phlegm: Wen Dan Tang or Di Tan Tang. Blood stasis: minimal Tao Hong Si Wu Tang. Heart-Kidney: Tian Wang Bu Xin Dan (gentle doses).
How to address sleep issues in the elderly?,"Elderly sleep changes: lighter sleep, early waking, napping. Pathological insomnia shows Yin deficiency, Heart-Kidney disconnection, Heart Blood deficiency, or Spleen-Heart disharmony. Pain, nocturia, medications, and sleep apnea affect sleep. Gentle, supportive treatment.","HT-7 (Shenmen), KI-6 (Zhaohai), SP-6 (Sanyinjiao), Anmian, Yintang, PC-6 (Neiguan), BL-15 (Xinshu), BL-23 (Shenshu)",Suan Zao Ren Tang (gentle dose) for Heart Blood deficiency; Tian Wang Bu Xin Dan (reduced) for Heart-Kidney; Liu Wei Di Huang Wan for Yin deficiency; avoid strong sedating herbs.
What pain patterns are common in elderly adults?,"Chronic pain reflects Liver-Kidney deficiency (joints, back), Qi and Blood deficiency, Blood stasis, Cold-Damp Bi syndrome, or osteoarthritis. Pain affects mobility and quality of life significantly. Balance pain relief with safety; coordinate with pain management physicians.","Location-specific points + distal: ST-36, SP-6, LI-4, KI-3, BL-23 for back, GB-34 for knees, LR-3 generally. Local Ashi points gently. Consider ear acupuncture",Du Huo Ji Sheng Tang for Liver-Kidney deficiency with Bi; Juan Bi Tang for chronic joint pain; Shen Tong Zhu Yu Tang if Blood stasis prominent (gentle dose); external liniments.
How to address poor appetite and weight loss?,"Poor appetite indicates Spleen Qi deficiency, Stomach Yin deficiency (no hunger), Liver Qi stagnation (depression), or serious illness. Weight loss concerning in elderly - assess dentition, swallowing, depression, medications, and underlying diseases. Gentle Spleen support.","ST-36 (Zusanli), REN-12 (Zhongwan), SP-6 (Sanyinjiao), PC-6 (Neiguan), BL-20 (Pishu), BL-21 (Weishu), REN-6 (Qihai)",Si Jun Zi Tang (Four Gentlemen) or Shen Ling Bai Zhu San for Spleen Qi; Xiang Sha Liu Jun Zi Tang if Qi stagnation present; Yi Wei Tang for Stomach Yin deficiency; small frequent doses.
What causes constipation in the elderly?,"Elderly constipation extremely common: Qi deficiency (no power to move), Blood and Yin deficiency (intestinal dryness), Yang deficiency (slow motility), medications (especially opioids), or immobility. Gentle, moistening approach essential. Monitor for obstruction.","ST-25 (Tianshu), ST-36 (Zusanli), SJ-6 (Zhigou), KI-6 (Zhaohai), SP-15 (Daheng), gentle clockwise abdominal massage, BL-25 (Dachangshu)",Ma Zi Ren Wan (Hemp Seed Pill) or Zeng Ye Tang (Increase Fluids) for deficiency-dryness type; Warm the Kidney to move if Yang deficiency; adjust to individual pattern gently.
How to treat urinary incontinence and frequency?,"Urinary issues show Kidney Qi not consolidating (stress incontinence), Kidney Yang deficiency (frequency, nocturia), Bladder Damp-Heat (urgency, infection), or Spleen Qi sinking. Significantly impacts dignity and quality of life. Supportive, compassionate treatment.","KI-3 (Taixi), SP-6 (Sanyinjiao), REN-4 (Guanyuan), REN-3 (Zhongji), BL-23 (Shenshu), BL-28 (Pangguangshu), ST-36 (Zusanli), DU-20 (Baihui) for sinking",Kidney Yang deficiency: Jin Gui Shen Qi Wan (gentle dose). Kidney Qi not consolidating: Suo Quan Wan. Spleen sinking: Bu Zhong Yi Qi Tang. Damp-Heat: gentle clearing formula.
How does loneliness and grief affect elderly health?,"Loneliness and grief deeply deplete Heart Qi and Blood, create Liver Qi stagnation, weaken Spleen (worry), and accelerate decline. Loss of spouse, friends, independence creates profound Shen disturbance. Compassionate presence and social connection support are medicine.","HT-7 (Shenmen), PC-6 (Neiguan), REN-17 (Shanzhong), SP-6 (Sanyinjiao), LR-3 (Taichong), Yintang, DU-20 (Baihui)",Gui Pi Tang (Restore Spleen) for Heart-Spleen deficiency with worry; Gan Mai Da Zao Tang for grief and emotional instability; gentle doses; therapeutic relationship itself is healing.
What role does social support play in treatment?,"Social connection nourishes Heart and Shen, provides practical assistance, reduces isolation-related decline. Family contact, friends, community groups, and caregiver support crucial for treatment success and quality of life. Assess and support social network.","Treatment supports patient's ability to engage socially: reduce pain, improve mood, increase energy. Core points: ST-36, HT-7, REN-17, DU-20, SP-6","Formulas that improve energy and mood enhance social engagement: Gui Pi Tang, Bu Zhong Yi Qi Tang. Social connection itself is therapeutic - encourage maintained relationships."
How do sensory losses affect safety and treatment?,"Hearing loss, vision decline, and balance issues increase fall risk, isolation, depression, and treatment challenges (hearing instructions, reading labels). TCM supports remaining function, addresses root Kidney-Liver deficiency, and adapts treatment to sensory limitations.","KI-3 (Taixi), BL-23 (Shenshu), GB-2 (Tinghui) for hearing, BL-1 (Jingming), GB-37 (Guangming) for vision, GB-20 (Fengchi), GB-39 (Xuanzhong) for balance",Liu Wei Di Huang Wan for Kidney-Liver Yin nourishing eyes/ears; Du Huo Ji Sheng Tang for balance support; realistic expectations about reversing age-related decline.
What does climate sensitivity reveal in elderly?,"Extreme sensitivity to cold indicates Yang deficiency (Kidney, Spleen). Heat intolerance shows Yin deficiency. Wind sensitivity shows Wei Qi weakness. Elderly cannot thermoregulate as well. Climate reactions guide diagnosis and treatment; heating/cooling devices necessary.","Cold sensitivity: moxa on REN-4, REN-6, ST-36, BL-23, DU-4. Heat intolerance: KI-3, KI-6, SP-6, LU-7. Wind: LU-7, LI-4, GB-20, strengthen Wei Qi",Yang deficiency: You Gui Wan or Jin Gui Shen Qi Wan (gentle). Yin deficiency: Liu Wei Di Huang Wan or Zuo Gui Wan (gentle). Wei Qi: Yu Ping Feng San at reduced dose.
How to address osteoporosis and fracture risk?,"Osteoporosis represents severe Kidney Jing and essence depletion - Kidney governs bones. Fracture risk increases with falls, weakness. Prevention through Kidney tonification, fall prevention, safe environment. Already fractured: support healing and constitutional restoration.","BL-23 (Shenshu), KI-3 (Taixi), BL-11 (Dazhu - bone meeting point), DU-4 (Mingmen), ST-36 (Zusanli), GB-39 (Xuanzhong - marrow meeting point), SP-6 (Sanyinjiao)","Modified Liu Wei Di Huang Wan or Zuo Gui Wan with bone-strengthening additions: Gu Sui Bu (Drynaria), Xu Duan (Dipsacus), Du Zhong (Eucommia); long-term gentle support."
What cardiovascular symptoms require special attention?,"Chest pain, palpitations, breathlessness, ankle swelling, orthopnea indicate Heart Qi, Yang, or Blood deficiency, Blood stasis, or Phlegm obstruction. Many have diagnosed heart disease. TCM provides supportive care; coordinate closely with cardiologist; know medication interactions.","HT-7 (Shenmen), PC-6 (Neiguan), REN-17 (Shanzhong), ST-36 (Zusanli), SP-6 (Sanyinjiao), BL-15 (Xinshu), very gentle treatment","Heart Qi deficiency: modified Sheng Mai San. Heart Yang: Shen Fu Tang (expert only, careful). Blood stasis: gentle San Qi or Dan Shen. AVOID with blood thinners without coordination."
How does sleep apnea present in TCM terms?,"Sleep apnea represents Phlegm-Dampness obstructing airways with Spleen and Kidney deficiency. Shows as daytime fatigue, poor sleep quality, witnessed apnea episodes. CPAP compliance important. TCM supports underlying patterns and quality of life.","ST-40 (Fenglong), SP-9 (Yinlingquan), ST-36 (Zusanli), REN-12 (Zhongwan), LU-7 (Lieque), REN-22 (Tiantu), gentle treatment supporting breathing",Er Chen Tang or Liu Jun Zi Tang to transform Phlegm-Dampness and strengthen Spleen; gentle Kidney support if deficiency prominent; realistic expectations - CPAP often necessary.
How do elderly cope with loss and dependency?,"Coping with loss of abilities, independence, loved ones requires emotional resilience. Heart Blood and Shen strength determine coping capacity. Some accept gracefully (strong Shen), others struggle (depleted Heart-Kidney). Support emotional processing and adaptation.","HT-7 (Shenmen), PC-6 (Neiguan), Yintang, REN-17 (Shanzhong), SP-6 (Sanyinjiao), KI-3 (Taixi), gentle calming treatment",Gui Pi Tang for Heart-Spleen support; Gan Mai Da Zao Tang for emotional distress; Tian Wang Bu Xin Dan for Heart-Kidney disconnection; compassionate listening is primary medicine.
What is the importance of daily routine assessment?,"Daily routine reveals functional capacity, energy patterns, social engagement, and quality of life. Morning difficulty shows Yang deficiency. Afternoon fatigue shows Qi deficiency. Evening better shows Yin deficiency patterns. Routine structure supports organ clock function.",Adjust treatment timing to patient's best energy time. Support deficient organs: Yang deficiency→morning moxa; Qi deficiency→tonification; Yin deficiency→afternoon/evening treatment,Time-based formulas: Morning Yang support; afternoon Qi tonification; evening Yin nourishment. Encourage regular routine supporting circadian rhythm and organ clock.
How to honor hobbies and meaningful activities?,"Activities that bring joy nourish Heart and Shen, provide purpose, maintain cognitive function, and support will to live. Modified activities preserve identity and engagement. TCM supports physical ability to continue meaningful pursuits.","Support activities through symptom relief: pain reduction, energy increase, mood improvement. Functional goals drive point selection",Formulas supporting function for activities: energy→Bu Zhong Yi Qi Tang; pain→Du Huo Ji Sheng Tang; mood→Gui Pi Tang; cognition→Liu Wei Di Huang Wan with modifications.
What are realistic expectations for elderly TCM treatment?,"Realistic goals: improved quality of life, symptom reduction, better function, enhanced wellbeing - NOT reversing aging or curing chronic diseases. Focus on what matters to patient: less pain, better sleep, maintained independence, emotional calm. Quality over quantity of years.","Treatment goals guide point selection. Pain→local+distal; Sleep→calming points; Energy→tonification; Mood→Shen-calming. Gentle, patient approach","Herbal goals: gentle support, symptom management, constitutional strengthening within limits of age. Honest about limitations while offering meaningful help."
How to address advanced directives and treatment goals?,"Understanding end-of-life wishes and healthcare goals ensures TCM treatment aligns with patient values. Some want aggressive intervention, others comfort-focused. TCM can support both approaches. Respect autonomy and wishes in treatment planning.","Treatment intensity adjusted to goals: aggressive→more frequent, comprehensive; comfort-focused→gentle, symptom-focused, quality of life emphasized",Formula intensity matches goals. Palliative focus: gentlest symptom relief. Active treatment: stronger constitutional support. Always respect patient wishes and dignity.
How does incontinence affect dignity and social life?,"Incontinence profoundly impacts dignity, causes social isolation, depression, and reduced quality of life. Address compassionately without embarrassment. TCM can often improve bladder control while supporting emotional impact of this sensitive issue.","KI-3 (Taixi), SP-6 (Sanyinjiao), REN-4 (Guanyuan), REN-3 (Zhongji), BL-23 (Shenshu), BL-28 (Pangguangshu), ST-36 (Zusanli), DU-20 (Baihui)",Jin Gui Shen Qi Wan for Kidney Yang; Suo Quan Wan for Kidney Qi; Bu Zhong Yi Qi Tang if Spleen Qi sinking; regular treatment often shows improvement.
How to balance social engagement vs. solitude needs?,"Some elderly crave connection (Heart Qi and Blood need nourishment), others prefer solitude (may indicate Yin deficiency, introversion, or peace with aging). Changes from previous patterns may indicate depression or declining energy. Honor individual needs.","Social withdrawal from depression: HT-7, PC-6, REN-17, DU-20, ST-36. Peaceful solitude: support with gentle nourishment rather than changing natural tendency",Depression-related withdrawal: Gui Pi Tang or Xiao Yao San. Natural temperament: gentle constitutional support matching their needs without forcing social engagement.
What heat and cold therapies support elderly patients?,"Many elderly already use hot water bottles, heating pads, warm baths for pain and cold sensitivity. Cooling packs for arthritis inflammation. These home therapies reveal their temperature patterns and can be encouraged as adjunct treatment.",Support self-care thermal therapy with appropriate acupuncture: Cold conditions→moxa; Heat conditions→cooling points. Teach safe use of heat (avoid burns on thin elderly skin),"Prescribe warming herbs for cold types, cooling for heat types, aligned with their successful home thermal therapy. External herbal compresses and soaks extend treatment."
How to address swallowing difficulties safely?,"Dysphagia indicates Spleen-Kidney deficiency, Phlegm obstruction, or stroke sequelae. Aspiration pneumonia risk serious in elderly. TCM supports swallowing function but must coordinate with speech therapy. Thickened liquids or texture modification may be needed for safety.","REN-22 (Tiantu), REN-23 (Lianquan), ST-9 (Renying - carefully), LI-4 (Hegu), ST-36 (Zusanli), REN-12 (Zhongwan), gentle local and distal treatment",Spleen-Kidney: Liu Jun Zi Tang with Kidney support. Phlegm: Er Chen Tang modified. Post-stroke: Bu Yang Huan Wu Tang (gentle). Pill form herbs may need to be powdered or liquid.
What causes orthostatic hypotension and dizziness?,"Dizziness on standing represents Qi and Blood deficiency (insufficient to reach head), Heart Qi weakness, Kidney Jing deficiency, or medication effects. Fall risk high. May need medication adjustment. TCM supports Qi ascending and Blood nourishment.","ST-36 (Zusanli), SP-6 (Sanyinjiao), DU-20 (Baihui), REN-6 (Qihai), GV-4 (Mingmen), BL-23 (Shenshu), gentle upward directing Qi",Bu Zhong Yi Qi Tang - classical formula for Qi sinking and orthostatic issues; gentle dose; coordinate with physician about blood pressure medications.
How do recent hospitalizations affect treatment planning?,"Recent hospitalization indicates serious illness, procedures, or exacerbation. Post-hospital: weakened constitution, medication changes, emotional distress, functional decline. TCM provides gentle recovery support, rebuilding Qi, addressing complications.","Gentle constitutional restoration: ST-36, SP-6, KI-3, HT-7, REN-4, REN-6. Address specific post-hospital symptoms gently. Very short retention times initially",Gentle tonification: modified Bu Zhong Yi Qi Tang or Gui Pi Tang. Post-surgical: mild Si Jun Zi Tang. Very gentle approach - they are fragile post-hospitalization.
What determines 'appetite for life' in elderly patients?,"Sense of purpose, future plans, hope versus hopelessness reveals Kidney Zhi (willpower), Heart Shen (spirit), and overall vitality. Loss of appetite for life indicates profound Heart-Kidney depletion, depression, or approaching end of life. Compassionate support essential.","Support vitality: HT-7 (Shenmen), KI-3 (Taixi), REN-4 (Guanyuan), DU-20 (Baihui), REN-17 (Shanzhong), Yintang. Gentle rekindling of spirit",Gui Pi Tang for Heart-Spleen; modified Kidney tonics for Zhi (willpower); Gan Mai Da Zao Tang for emotional support. Sometimes presence and listening more important than herbs.
How does pain timing reveal Blood vs. Qi patterns?,Pain worse at night indicates Blood deficiency or Blood stasis (Blood cannot nourish properly). Pain worse with activity shows Qi deficiency (Qi cannot move properly). Pain better with movement suggests Qi stagnation. Timing guides diagnosis and treatment.,"Night pain: nourish Blood - SP-6, BL-17, ST-36, LR-8, local points. Day/activity pain: tonify Qi - ST-36, REN-6, DU-20, local points with moxa",Night pain: Si Wu Tang or modified. Activity pain: Bu Zhong Yi Qi Tang. Both: Ba Zhen Tang (Eight Treasures). Adjust to specific location and nature of pain.
How to assess hydration status in elderly?,"Elderly often inadequately hydrated: decreased thirst sensation, fear of incontinence, forgetting. Dehydration shows as Yin and Fluid deficiency, affects cognition, constipation, skin. Monitor intake. Tea/coffee dehydrating. Fluid restrictions (CHF) complicate. Balance carefully.","Support fluid metabolism: SP-9 (Yinlingquan), REN-9 (Shuifen), ST-36 (Zusanli), KI-3 (Taixi), SP-6 (Sanyinjiao) - gentle regulation",Yin and Fluid deficiency: Liu Wei Di Huang Wan or Zeng Ye Tang (Increase Fluids). If Dampness present despite dehydration: Wu Ling San carefully. Education about adequate fluids.
What do stool characteristics reveal about digestion?,"Dry, hard stools show Blood-Yin deficiency or Heat. Loose stools indicate Spleen Yang deficiency or Dampness. Undigested food shows Spleen Qi deficiency. Black stools need medical evaluation (GI bleeding). Pale stools suggest Liver-Gallbladder issues. Daily assessment guide.","Dry→moisten: KI-6, SP-6, ST-36. Loose→warm and strengthen: ST-36, SP-6, REN-12, moxa on REN-8 carefully. Adjust treatment to stool pattern",Dry: Ma Zi Ren Wan or Zeng Ye Tang. Loose: Si Jun Zi Tang or Li Zhong Wan. Undigested food: Shen Ling Bai Zhu San. Pattern-specific gentle formulas.
What is sundowning and how to address it?,"Sundowning (evening confusion, agitation in dementia) represents Yin deficiency with Yang floating, Heart-Kidney disconnection, and disrupted circadian rhythm. Organ clock disturbance. Requires environmental management plus TCM support for Yin and Shen.","HT-7 (Shenmen), KI-6 (Zhaohai), SP-6 (Sanyinjiao), Yintang, Anmian, KI-3 (Taixi) - afternoon treatment to prevent evening symptoms",Tian Wang Bu Xin Dan (gentle dose) for Heart-Kidney; Liu Wei Di Huang Wan for Yin deficiency; treatment timing important - afternoon sessions may help prevent evening agitation.
How does living situation affect treatment success?,"Living alone requires more independence for home care. Family support enables more complex treatment. Assisted living/nursing home affects autonomy, routine, social connection. Satisfaction with situation affects emotional state and cooperation. Adapt treatment to living circumstances.","Consider access to clinic, ability to do home care, medication management capacity. Simple protocols for those with limited support",Simple formulas (fewer herbs) for those managing alone. Family education for complex protocols. Pre-made granules easier than raw herbs for those with cognitive decline or limited support.
How does sleep environment affect rest quality?,"Noise, light, temperature extremes, uncomfortable bed, safety concerns all disrupt sleep. Many elderly sleep with lights on (fear of falls), TV on (loneliness), in recliners (orthopnea). Environment modifications often as important as treatment.","Address sleep issues with appropriate acupuncture while educating about sleep hygiene: darkness, quiet, comfort, safety, appropriate temperature",Sleep formulas work better with good sleep environment. Sometimes environmental changes more effective than herbs. Practical problem-solving part of holistic care.
How to address depression and anxiety history?,"Many elderly have long depression/anxiety history, tried multiple medications, or have treatment-resistant patterns. Past failures affect expectations. TCM offers alternative approach. Assess what helped/didn't help previously to guide treatment strategy.","HT-7 (Shenmen), PC-6 (Neiguan), PC-7 (Daling), Yintang, DU-20 (Baihui), REN-17 (Shanzhong), Ear Shen Men - regular consistent treatment",Gui Pi Tang for worry-type depression; Xiao Yao San for stagnation-type; Gan Mai Da Zao Tang for severe emotional distress. Gentle doses. Patience required - often takes months.
What coping strategies support resilience?,"Prayer, reading, music, nature, walking, conversation - these activities nourish Heart and Shen, provide structure, maintain engagement. Support and encourage positive coping. TCM treatment enhances capacity for healthy coping by improving energy, pain, mood.","Treatment enables coping activities by reducing barriers: pain, fatigue, mood disturbance. Functional treatment goals align with coping strategies","Formulas supporting coping capacity: energy for activities (Bu Zhong Yi Qi Tang), mood stability (Gui Pi Tang), calm for prayer/meditation (Suan Zao Ren Tang)."
How do dietary restrictions affect herbal prescribing?,"Religious (kosher, halal), cultural, or medical restrictions (renal diet, diabetic, low sodium) affect both food therapy and herbal medicine. Some herbs contraindicated in kidney disease. Respect restrictions while working within them.",Acupuncture not affected by dietary restrictions. Point selection based on patterns regardless of diet limitations,Review herbs for dietary restrictions: avoid certain animal products if vegetarian; check herbs in kidney disease; monitor sweet herbs in diabetes. Work creatively within restrictions.
What mobility aids indicate and how to support safely?,"Grab bars, raised toilet, stair rails, cane, walker indicate balance issues, weakness, fall risk. Their presence shows awareness and adaptation. Their absence in needed situations shows denial or financial/access barriers. Safety assessment part of care.","Treatment supports safe mobility: strengthen legs (ST-36, GB-34), improve balance (GB-39, KI-3), reduce pain enabling movement. Fall prevention is treatment success","Du Huo Ji Sheng Tang supports muscles, bones, joints for mobility; Bu Zhong Yi Qi Tang for Qi sinking and weakness; realistic goals focused on safe function."
