Question,Answer,Acupuncture Points,Chinese Pharmacopeia
How to address swallowing changes and eating habits?,"Choking episodes create fear of eating, leading to restricted diet, weight loss, malnutrition. May indicate Spleen-Kidney weakness, Phlegm, or neurological issues. Speech therapy plus TCM support. Texture modifications and eating techniques important.","REN-23 (Lianquan), REN-22 (Tiantu), ST-9 (Renying - carefully), LI-4 (Hegu), ST-36 (Zusanli), BL-20 (Pishu), gentle supportive treatment",Liu Jun Zi Tang for Spleen-Phlegm; Kidney support if deficiency present. Herbs may need liquid or powder form. Focus on safe nutrition however achieved.
What skin changes require attention in elderly?,"Thin, fragile skin (Blood-Yin deficiency), dryness (Yin deficiency), poor healing (Qi-Blood deficiency), bruising (Blood deficiency), ulcers (Qi-Blood stagnation, poor circulation). Skin reflects internal state. Pressure ulcers serious. Gentle needle technique essential.","SP-6 (Sanyinjiao), SP-10 (Xuehai), ST-36 (Zusanli), BL-17 (Geshu - Blood meeting point), gentle stimulation. Local points around but not in ulcers",Si Wu Tang for Blood deficiency; Ba Zhen Tang for Qi and Blood; modified Liu Wei Di Huang Wan for Yin. External herbal compresses for wounds if appropriate.
What are elderly patients' main health worries?,"Common fears: loss of independence, uncontrolled pain, memory loss, becoming burden, dying alone. Understanding fears helps address them realistically through treatment and emotional support. Fear itself depletes Kidney (fear injures Kidney).","Address fears by treating symptoms that threaten independence: pain, weakness, cognitive decline. Fear itself: HT-7, KI-3, PC-6, Yintang, calming approach","Formulas addressing fear roots: pain control, cognitive support, strength. Calming Shen for fear itself: modified Gui Pi Tang or An Shen formulas. Compassionate reassurance."
What are realistic hopes for TCM treatment outcomes?,"Patients often hope for: less pain, better sleep, improved calm, maintained mobility. These are achievable goals. Realistic expectations about not reversing aging, curing chronic disease, or becoming young again. Focus on achievable quality of life improvements.","Point selection targets realistic goals. Pain→local+distal; Sleep→HT-7, Anmian; Calm→PC-6, Yintang; Mobility→ST-36, GB-34. Measure success by patient-defined outcomes","Herbal formulas support achievable goals. Pain management, sleep improvement, mood stability, energy support - these often show good results with consistent treatment."
How to encourage home self-care practices?,"Simple practices: gentle stretching, deep breathing, warm compresses, regular meal times, adequate hydration. Assess willingness and capacity. Some eager, others resistant or unable. Adapt recommendations to individual capacity and motivation.","Teach self-acupressure on accessible points: HT-7, PC-6, LI-4, ST-36. Demonstrate during treatment. Written simple instructions with pictures",Herbal tea recommendations for simple conditions. Dietary guidance within their capacity. Realistic expectations about compliance based on cognitive and physical function.
How to manage needle fear and vasovagal responses?,"Many elderly fear needles, had bad experiences, or have vasovagal history. Start with fewer, smaller needles, explain everything, allow control (can ask to stop). Consider ear acupuncture, seeds, or tuina if needle fear severe. Safety and trust paramount.","Start minimal: 4-6 points, thinnest needles, patient can see insertion. Avoid threatening points initially. Build trust gradually. Have patient semi-reclined, never standing",Herbs don't cause needle fear - can be primary treatment while building needle tolerance. Some patients never tolerate needles - herbs alone can be effective.
What support systems enable treatment success?,"Transport to clinic, help at home post-treatment, medication management, meal preparation - these supports enable regular treatment and compliance. Assess caregiver burden. Isolated patients have poorer outcomes. Social support is treatment prerequisite.",Treatment frequency and complexity must match support system capacity. Weekly treatment requires transport. Complex herbal protocols require help managing,Simple herbal protocols for those with limited support. More complex for those with good support system. Sometimes treating caregiver equally important for patient success.
How do major life changes affect elderly health?,"Bereavement, moving, new diagnosis, loss of partner profoundly impact health through Heart Blood depletion, Shen disturbance, Kidney depletion (grief), and stress affecting all organ systems. Major life changes can precipitate rapid decline or be opportunity for growth.","Support through transitions: HT-7, PC-6, KI-3, SP-6, REN-17, Yintang. Frequent sessions during crisis periods provide stability",Gui Pi Tang for Heart-Spleen support through grief; Gan Mai Da Zao Tang for acute emotional crisis; Kidney tonics for constitutional depletion from grief. Compassionate presence crucial.
How to create safe communication about difficult topics?,"Some topics embarrassing (incontinence, sexuality), scary (death, memory loss), or culturally sensitive. Create safe, non-judgmental space. Ask permission before discussing sensitive topics. Respect if patient not ready. Trust building takes time.","Gentle, compassionate treatment builds trust enabling difficult conversations. Body-based therapy sometimes opens emotional access when words fail",Treatment effectiveness improves when patient feels safe sharing fully. Respect boundaries while remaining available for when they're ready to discuss difficult topics.
What matters most to elderly patients at this life stage?,"Priorities vary: maintaining independence, reducing suffering, family relationships, spiritual practice, completing life tasks, dignified dying. Understanding what matters guides treatment toward supporting those priorities rather than imposing practitioner's goals.",Treatment aligns with patient values: independence→functional support; comfort→symptom relief; relationships→energy for engagement; spiritual→calm and clarity,Herbal support matches values: active living goals→tonification; comfort focus→gentle symptom relief; quality of connection→mood and energy support. Patient-centered care always.
